{
  "$schema": "https://json-schema.org/draft/2020-12/schema",
  "$id": "https://raw.githubusercontent.com/buchochelliq-labs/rs-rich-cli/main/schemas/marketplace/index.schema.json",
  "title": "rs-rich marketplace index",
  "description": "The signed index of the rs-rich marketplace: every listing file and its SHA-256, a serial that only grows, and an expiry. index.json.minisig signs it. See docs/design/marketplace.md.",
  "type": "object",
  "required": ["schema_version", "serial", "generated", "expires", "listings"],
  "additionalProperties": false,
  "properties": {
    "schema_version": {"const": 1},
    "serial": {"description": "Grows by one with every signed index; a client refuses a smaller one than it has seen.", "type": "integer", "minimum": 1},
    "generated": {"$ref": "#/$defs/timestamp"},
    "expires": {"description": "A client refuses the index after this time.", "$ref": "#/$defs/timestamp"},
    "listings": {
      "description": "Every listing, by id.",
      "type": "object",
      "propertyNames": {"maxLength": 64, "pattern": "^[a-z0-9][a-z0-9._-]*$"},
      "additionalProperties": {
        "type": "object",
        "required": ["path", "sha256"],
        "additionalProperties": false,
        "properties": {
          "path": {"description": "The listing file, relative to the index.", "type": "string", "pattern": "^packages/[a-z0-9][a-z0-9._-]*\\.json$"},
          "sha256": {"type": "string", "pattern": "^[0-9a-f]{64}$"}
        }
      }
    }
  },
  "$defs": {
    "timestamp": {"description": "UTC, RFC 3339, to the second.", "type": "string", "pattern": "^[0-9]{4}-[0-9]{2}-[0-9]{2}T[0-9]{2}:[0-9]{2}:[0-9]{2}Z$"}
  }
}
